### ISSUE TITLE
Warning: no permission to capture device

### ISSUE THREAD

**Issue by elabbing** [christophe-calmejane/Hive#88]
Hello, 
a little help please...
I'm trying some tests with Hive 1.2.1, using updated Ubuntu Bionic on PC.
It has 2 NICs, 
Intel Corporation I210 Gigabit Network Connection, cabled disconnected, no IP
Intel Corporation 82567LF-3 Gigabit Network Connection, connected to my LAN, fixed IP.
For both NICs, following errors from log:
```
2020-04-15 - 18:14:31	Generic	Info	Using libpcap.so: libpcap version 1.8.1
2020-04-15 - 18:14:31	Generic	Info	Using libpcap.so: libpcap version 1.8.1
2020-04-15 - 18:14:31	Hive	Warning	enp0s25: You don't have permission to capture on that device (socket: Operation not allowed)
2020-04-15 - 18:14:35	Generic	Info	Using libpcap.so: libpcap version 1.8.1
2020-04-15 - 18:14:35	Generic	Info	Using libpcap.so: libpcap version 1.8.1
2020-04-15 - 18:14:35	Hive	Warning	enp1s0: You don't have permission to capture on that device (socket: Operation not allowed)
```
I have to run Hive with `sudo`?
I have to install some other libraries?
Hive has to be installed on every node belonging the TSN/AVB network?

Thanks a lot
Best regards

**Comment by christophe-calmejane** [comment]
Hi,
sorry I missed this issue!
On linux, you either have to run it as root, or you have to give user permissions to the capture device. I think google might help you correctly setting up permissions for your system (better than me).

You only need to install Hive on one computer, as one controller is usually enough on an AVB network.

**Comment by christophe-calmejane** [comment]
Have you solved your issue?

**Comment by elabbing** [comment]
Hello, I try to run as `sudo` ,
but Hive hangs indefinitely and I have kill the process. Moreover, sudo run gives the   following:
```
@ubuntu:~/Documents/Hive/build/src$ sudo ./Hive-d
QStandardPaths: XDG_RUNTIME_DIR not set, defaulting to '/tmp/runtime-root'
^C
```

I took a look about this issue, it could depend by `tcpdump` without admin/root permission. On my system, tcpdump not has permissions with non-root users, but if I try to run `sudo tcpdump` it works fine:
```
@ubuntu:~/Documents/Hive/build/src$ sudo tcpdump -i  enp1s0
tcpdump: verbose output suppressed, use -v or -vv for full protocol decode
listening on enp1s0, link-type EN10MB (Ethernet), capture size 262144 bytes
17:06:44.755488 IP6 fe80::76da:88ff:feb9:6260 > ip6-allnodes: ICMP6, router advertisement, length 64
17:06:44.767295 IP ubuntu.55471 > resolver2.opendns.com.domain: 48866+ [1au] PTR? 0.6.2.6.9.b.e.f.f.f.8.8.a.d.6.7.0.0.0.0.0.0.0.0.0.0.0.0.0.8.e.f.ip6.arpa. (101)
17:06:44.767340 IP6 ubuntu > ff02::16: HBH ICMP6, multicast listener report v2, 4 group record(s), length 88
...
^C
```

If I well understand, Hive uses `tcpdump` to capture eth devices, then why the issue if I run Hive as `sudo`?
Many thanks

**Comment by Florob** [comment]
FWIW here is what I do:

On Linux you can give executables certain "capabilities" they usually don't have.
Hive in particular needs CAP_NET_RAW to use raw ethernet sockets.
You can achieve this by running `sudo setcap cap_net_raw+ep Hive` on the Hive executable.
Hive can be run without root privileges afterwards.

**Comment by christophe-calmejane** [comment]
Thanks for the information. As soon as I get my hands back on a working linux box, I'll try this and put it in the documentation.

**Comment by elabbing** [comment]
> FWIW here is what I do:
> 
> On Linux you can give executables certain "capabilities" they usually don't have.
> Hive in particular needs CAP_NET_RAW to use raw ethernet sockets.
> You can achieve this by running `sudo setcap cap_net_raw+ep Hive` on the Hive executable.
> Hive can be run without root privileges afterwards.

Thanks for your hint.
I tried, Hive seems able to use raw ethernet socket without `sudo `, but hangs if I try to change eth interfaces (I have 2 adapter).
Hive starts with `enp1s0`, it's disconnetcted because used only for test.
Menus works fine, then I try to change to `enp25s1` and Hive stucks without changing adapter (menu remains grayed on `enp0s1`).

Here log at start:
```
2020-06-01 - 18:38:03	Hive	Debug	Settings location: /home/iemai/.config/KikiSoft/Hive.conf
2020-06-01 - 18:38:03	Generic	Info	Using libpcap.so: libpcap version 1.8.1
2020-06-01 - 18:38:03	Generic	Info	Using libpcap.so: libpcap version 1.8.1
2020-06-01 - 18:38:03	Generic	Info	Using libpcap.so: libpcap version 1.8.1
2020-06-01 - 18:38:03	Controller	Info	[0x6cb3110004523b81] AEM-CACHE Disabled
```
Then I try to set down `enp1s0` and Hive seems to work:
```
2020-06-01 - 18:47:34	Hive	Debug	Settings location: /home/iemai/.config/KikiSoft/Hive.conf
2020-06-01 - 18:47:34	Generic	Info	Using libpcap.so: libpcap version 1.8.1
2020-06-01 - 18:47:34	Hive	Warning	No Network Interface selected. Please choose one.
2020-06-01 - 18:47:39	Generic	Info	Using libpcap.so: libpcap version 1.8.1
2020-06-01 - 18:47:39	Generic	Info	Using libpcap.so: libpcap version 1.8.1
2020-06-01 - 18:47:39	Controller	Info	[0x001999000485713a] AEM-CACHE Disabled
```

At present, I have no network to test effectiveness in node discovery.
I hope that above can be useful.
Best regards

**Comment by christophe-calmejane** [comment]
Hi, I did manage to reproduce the freeze issue, and I'll try to take a look when possible.
Thanks for the report.

PS: I also confirm the setcap command to be working, I'll see what I can do. Thanks a lot for the information.

**Comment by christophe-calmejane** [comment]
Another good news, I understand why you have freeze when switching interface.
It's because of multiple factors:
- you have a recent linux kernel
- I completely misunderstood how pcap timeouts work
- Your interface probably never received any packet, thus never triggered the timeout, meaning deadlock :)

I'll try to fix this when possible.

**Comment by christophe-calmejane** [comment]
Related issues fixed
